title; description
Licenciatura em Bioengenharia;   Acreditação pela A3ESO ciclo de estudo encontra-se acreditado pela Agência de Avaliação e Acreditação do Ensino Superior (A3ES). Mais informação pode ser encontrada nos  relatórios produzidos pela A3ES.  Objetivos O principal objetivo é o de preparar recursos humanos com capacidade para abordarem de uma forma multidisciplinar problemas de biomedicina e de biotecnologia industrial sob as perspetivas da enga dos dispositivos, de processos e da engenharia molecular, promovendo a capacidade de compreensão sistemática num domínio específico.Pretende-se que os graduados sejam capazes de manipular, operar e manter sistemas e serviços em domínios específicos da Bioengenharia. Pretende-se também assegurar que os estudantes tenham contato experimental com técnicas de investigação, por forma a desenvolver a curiosidade/interesse pela realização de investigação científica de alto nível de carácter fundamental e/ou aplicado, segundo os parâmetros de qualidade e padrões éticos internacionalmente aceites.Nos objetivos de formação do plano de estudos incluem-se também o desenvolvimento de competências para realização de trabalho em grupo para a comunicação com os seus pares e com a comunidade académica e empresarial.  Saídas Profissionais Especialização em Engenharia Biomédica   Especialização em Engenharia Biológica   Especialização em Bioengenharia Molecular  Informações Disciplinas Específicas 2022/2023: 02 Biologia e Geologia19 Matemática A ou 07 Física e Quimica19 Matemática A  Comentários Programa MIBuddy:  https://www.fe.up.pt/~mibuddy  Contactos   catc@fe.up.pt      mtlima@icbas.up.pt Dados Gerais Informação para candidatosCódigo Oficial: 9540Codiretor: Maria da Conceição RangelCodiretor: Ana Maria MendonçaDiretor Adjunto: Filipe MergulhãoSigla: L.BIOGrau Académico: LicenciadoTipo de curso/ciclo de estudos: LicenciaturaInício: 2021/2022Duração: 3 Anos Planos de Estudos Plano Oficial do ano letivoTodos os Planos Unidades Orgânicas Envolvidas Faculdade de EngenhariaInstituto de Ciências Biomédicas Abel Salazar Diplomas Licenciatura em Bioengenharia - Engenharia Biológica (180 Créditos ECTS)Licenciatura em Bioengenharia - Bioengenharia Molecular (180 Créditos ECTS)Licenciatura em Bioengenharia - Engenharia Biomédica (180 Créditos ECTS) Áreas Científicas Predominantes BioengenhariaTodas as classificações Cursos/Ciclos de Estudos Antecessores MIB - Mestrado Integrado em Bioengenharia
Licenciatura em Engenharia Civil;    Acreditação pela A3ESO ciclo de estudo encontra-se acreditado pela Agência de Avaliação e Acreditação do Ensino Superior (A3ES). Mais informação pode ser encontrada nos  relatórios produzidos pela A3ES.  Objetivos O ciclo de estudos pretende formar licenciados com um conhecimento aprofundado de base da Engenharia Civil, que lhe permitam aplicar metodologias de análise, materiais, equipamentos e processos atualizados e adequados com respeito pela Ética, Ambiente e pelos superiores interesses da Comunidade. Essa formação deverá proporcionar a sua prossecução no 2º ciclo de Engenharia Civil. Para isso, oferece conhecimentos sólidos nas ciências básicas, nomeadamente na Matemática, na Física, na Programação e no Desenho Técnico e conhecimentos abrangentes nas grandes áreas científicas e técnicas da Engenharia Civil, com aplicação aprofundada de assuntos formativos iniciais, abordando as áreas de Estruturas, Materiais, Geotecnia, Construções, Hidráulica, Vias de Comunicação, Planeamento do Território, Ambiente e Transportes.OBJETIVOS DE APRENDIZAGEMi. Obter conhecimentos avançados nos domínios científicos e tecnológicos fundamentais da Engenharia Civil. Nas ciências básicas incluem-se conhecimentos aplicáveis nas áreas técnicas subsequentes e, nessas áreas técnicas, pretende-se assegurar a formação de base em Resistência de Materiais e Estruturas, Hidráulica e Ambiente, Física e Tecnologia das Construções e dos Materiais, Mecânica dos Solos, Planeamento do Território e Transportes, incluindo conhecimentos avançados em aspetos relevantes. ii. Desenvolver aptidões para o acesso a formação avançada no âmbito de um Mestrado em Engenharia Civil. iii. Criar competências que lhes permitam aplicar processos de análise de problemas de Engenharia Civil, realização de projetos de baixa complexidade, com pensamento crítico na tomada de decisões, capacidade de comunicação e trabalho em equipa, e vocação para a aprendizagem ao longo da vida.  Informações     Contactos    l.ec@fe.up.pt  www.fe.up.pt/dec   Dados Gerais Informação para candidatosCódigo Oficial: 9089Diretor: Miguel FerrazSigla: L.ECGrau Académico: LicenciadoTipo de curso/ciclo de estudos: LicenciaturaInício: 2021/2022Duração: 3 Anos Planos de Estudos Plano de estudos oficialTodos os Planos Diplomas Licenciatura em Engenharia Civil (180 Créditos ECTS) Áreas Científicas Predominantes Engenharia CivilTodas as classificações Cursos/Ciclos de Estudos Antecessores MIEC - Mestrado Integrado em Engenharia Civil
Licenciatura em Engenharia de Materiais;    Acreditação pela A3ESO ciclo de estudo encontra-se acreditado pela Agência de Avaliação e Acreditação do Ensino Superior (A3ES). Mais informação pode ser encontrada nos  relatórios produzidos pela A3ES.     Assegura-se, ainda, o desenvolvimento de competências transversais para a atividade de Engenharia ao longo do ciclo de estudos e de uma experiência em contexto real de trabalho no âmbito do projeto de licenciatura.  Objetivos O principal objetivo é o de formar licenciados com conhecimentos abrangentes em Ciências Básicas (Matemática, Química, Física) e em Ciências de Engenharia (Desenho e Métodos Computacionais), para além de conhecimentos específicos em Engenharia de Materiais que incluem uma visão ampla das propriedades, processamento e aplicações das grandes classes de Materiais (Metálicos, Cerâmicos e Poliméricos, onde se incluem os Nanomateriais e Biomateriais). Apesar de se tratar de uma formação de carácter abrangente, contemplando, inequivocamente, a progressão para a formação em segundo ciclo, a L.EMAT também prepara os estudantes para: intervir no vasto campo da Engenharia de Materiais,analisar e resolver problemas de engenharia em contextos diversificados, incluindo nessa análise os aspetos sociais, científicos e éticos mais relevantes,interagir com os pares dentro de equipas multidisciplinares, numa atitude colaborativa e de responsabilidade profissional e ética.  Informações Disciplinas Específicas: 07 Física e Química19 Matemática A Numerus Clausus: 27  Contactos   l.emat@fe.up.pt  Dados Gerais Informação para candidatosCódigo Oficial: 9096Diretor: Laura RibeiroDiretor Adjunto: Sonia SimõesSigla: L.EMATGrau Académico: LicenciadoTipo de curso/ciclo de estudos: LicenciaturaInício: 2021/2022Duração: 3 Anos Planos de Estudos Plano Oficial do ano letivo 2021Todos os Planos Diplomas Licenciatura em Engenharia de Materiais (180 Créditos ECTS) Áreas Científicas Predominantes Engenharia de MateriaisTodas as classificações Cursos/Ciclos de Estudos Antecessores MIEMM - Mestrado Integrado em Engenharia Metalúrgica e de Materiais
Licenciatura em Engenharia de Minas e Geo-Ambiente; Perfil Formativo A L.EMG é um primeiro ciclo de estudos (licenciatura) em engenharia de minas, organizado segundo o modelo de Bolonha, integrando-se na formação em minas da FEUP na seguinte forma:  Licenciatura em Engenharia de Minas e Geo-Ambiente, 3 anos e 180 ECTS, em que é feita a formação técnica básica Mestrado em Engenharia de Minas e Geo-Ambiente, 2 anos e 120 ECTS, de consolidação técnica.Doutoramento em Engenharia de Minas e Geo-Recursos, 3 anos e 180 ECTS, de desenvolvimento tecnológico e científico avançado. Este ciclo de licenciatura está organizado em três anos letivos, analisados a seguir de forma simplificada: No primeiro ano são estudados os temas básicos da ciência necessários ao engenheiro, nas áreas da Matemática, da Física, da Química e das Ciências da Terra (60 ECTS).No segundo ano são abordadas as temáticas tecnológicas transversais da engenharia como a aplicação da física aos materiais, ou da matemática ao cálculo (60 ECTS).No terceiro ano são abordados as tecnologias básicas da mineração, como as operações unitárias do processamento, e do desmonte / extração (60 ECTS).  Objetivos Os sistemas mineiros são especialmente complexos, dado serem híbridos naturais, sociais, ambientais e tecnológicos, terem enormes dimensões físicas e económicas, e um impacto ambiental, social e político muito relevante. Assim, a compreensão da mineração atual e do futuro exige: o domínio das ferramentas científicas e tecnológicas comuns da engenharia,um profundo conhecimento do domínio geológico e dos seus processos, desde a micro escala mineralógica até à escala planetária,o conhecimento das tecnologias mineiras, no seu sentido mais amplo de reconhecimento/prospeção, extração, processamento, compatibilização ambiental e comercialização,a capacidade de leitura sistémica da mina. Este alargado conhecimento de suporte é necessário para lidar com a tecnologia mineira e a sua complexa matéria prima.  O objetivo deste ciclo de estudos é preparar as bases de conhecimento científico e técnico, e de capacidades individuais de interação profissional que permitirão a formação de um técnico mineiro de topo capaz de conhecer, compreender, conceber e operar com todas estas dimensões. Prepara o adequado conhecimento de ciências básicas e da terra e de tecnologias transversais de engenharia e específicas de engenharia de minas, que serão fundamentais nos ciclos de estudo subsequentes e sem as quais o estudante não poderá desenvolver as ferramentas conceptuais para a compreensão sistémica de todo o processo mineiro, para a construção de visões integradoras das grandes áreas do ciclo produtivo da mineração.  Competências Profissionais O desenho da formação em engenharia de minas da FEUP fornece uma capacitação profissional completa no final do segundo ciclo (mestrado). O nível de formação de licenciaddo é apenas o primeiro degrau nessa capacitação. Os licenciados serão capazes de exercer atividade supervisionada em empresas mineiras, laboratórios de controlo de qualidade (pedreiras, águas minerais, laboratórios do Estado, etc.), em empresas de consultoria em engenharia civil ou em engenharia de minas, gabinetes de estudos de geologia, etc. Na conclusão deste primeiro ciclo, o licenciado em engenharia de minas: possui e sabe aplicar profissionalmente os seus conhecimentos extensos e a sua capacidade de compreensão na área dos georrecursos e da mineração,é capaz de resolver problemas na sua área de formação,é capaz de recolher, selecionar e interpretar a informação relevante, e de analisar os aspetos sociais, científicos e éticos relevantes,é capaz de comunicar as suas ideias e soluções,integra-se em equipas multi-disciplinares,é capaz de propor soluções inovadoras para problemas que enfrenta,está preparado para aprender ao longo da vida. Nesse sentido estará apto a participar em: exploração de minas metálicas e não metálicas,exploração de pedreiras de rochas industriais e ornamentais,exploração de águas minero-industriais, minerais naturais e de nascente,exploração de recursos energéticos geológicos, como carvão, gás natural, shale gas, petróleo e urânio,escavações subterrâneas ou a céu aberto associadas à construção e às obras públicas, como poços, túneis, cavernas,levantamento de impactes ambientais mineiros,recuperação e reabilitação ambiental,descontaminação e recuperação do solo, subsolo e aquíferos,reciclagem dos produtos gerados no ciclo de vida numa perspectiva de economia circular.  Informações Acreditação O ciclo de estudos foi acreditado pela A3ES, em 2022, sem condicionantes e por um período de 6 anos. Disciplinas específicas 02 Biologia e Geologia19 Matemática A ou 07 Física e Quimica19 Matemática A Numerus Clausus: 20 Ingresso: página para candidatos  Comentários A formação em engenharia de minas está presente na Universidade do Porto e na Faculdade de Engenharia desde 1885, pelo que o presente perfil formativo resulta duma evolução permanente, consistente, prudente, mas actualizada e consolidada.  Contactos Para mais esclarecimentos, por favor contacte: Paula Lima tel: + 351 220413163 minas@fe.up.pt  Departamento de Engenharia de MinasLicenciatura em Engenharia de Minas e Geo-Ambiente - Estudar na FEUP Dados Gerais Informação para candidatosCódigo Oficial: L236Diretor: Maria De Lurdes DinisSigla: L.EMGGrau Académico: LicenciadoTipo de curso/ciclo de estudos: LicenciaturaInício: 2008/2009Duração: 6 Semestres Planos de Estudos Plano de estudos oficial a partir de 2008/09Todos os Planos Diplomas Licenciatura em Engenharia de Minas e Geo-Ambiente (180 Créditos ECTS) Áreas Científicas Predominantes Ciências da Terra e da Engenharia de MinasTodas as classificações Cursos/Ciclos de Estudos Antecessores LEMI - Engenharia de MinasLEMG - Engenharia de Minas e Geoambiente
Licenciatura em Engenharia do Ambiente;    Acreditação pela A3ESO ciclo de estudo encontra-se acreditado pela Agência de Avaliação e Acreditação do Ensino Superior (A3ES). Mais informação pode ser encontrada nos  relatórios produzidos pela A3ES.    Engenharia do Ambiente - L.EA  A Engenharia do Ambiente é uma área de engenharia que combina as ciências físicas e do ambiente com as ciências tecnológicas (de engenharia).Os profissionais desta área dedicam-se à prevenção e identificação de efeitos ambientais perversos, à aplicação de tecnologias para os solucionar bem como à integração no desenvolvimento industrial e social, de soluções sustentáveis. A Engenharia do Ambiente está reportada no top 5 das profissões de Engenharia do Futuro (TOPUNIVERSITIES. Rankings), apresenta uma dimensão transversal e prevê-se cada vez mais presente nos projetos e intervenções na sociedade enquanto parte de um ecossistema. A partir do ano letivo de 2021/2022 a Faculdade de Engenharia da Universidade do Porto oferece dois ciclos de estudos independentes de Engenharia do Ambiente, a Licenciatura e o Mestrado. A licenciatura em Engenharia do Ambiente – L.EA – corresponde ao primeiro ciclo de estudos de ensino superior. Com um total de 180 créditos e uma duração de seis semestres, a conclusão desta licenciatura corresponde a um diploma de Licenciatura em Engenharia do Ambiente.Poderá descarregar a brochura do curso aqui.Poderá descarregar a folha de curso aqui.  Objetivos O principal objetivo da L.EA é dar formação de excelência nas ciências de base que alicerçam a Engenharia do Ambiente, nomeadamente nas áreas científicas básicas (ciências físicas e ciências naturais) e nas ciências tecnológicas comuns aos ciclos de estudo de engenharia (tais como fenómenos de transporte - mecânica de fluidos e transferência de calor e massa - e operações unitárias aplicadas em laboratórios de engenharia do ambiente) e específicas do domínio ambiental, complementadas por conhecimentos da área da gestão (métodos de decisão e ferramentas de decisão ambiental e planeamento).  Áreas de Especialização As áreas de especialização são definidas apenas aquando da prossecução para o M.EA, nomeadamente através de Unidades Curriculares de opção.  Competências Profissionais A L.EA permite a aquisição de competências que alicerçam uma formação completa em Engenharia do Ambiente.Os conhecimentos adquiridos na L.EA permitem a obtenção de aptidões que podem ser aplicadas na formulação, resolução e discussão de problemas ambientais e os adquiridos nas ciências tecnológicas e de engenharia num desenvolvimento preliminar de soluções para problemas ambientais e na antecipação e prevenção desses mesmos problemas, incluindo potenciais efeitos perversos, para qualquer compartimento ambiental (água, ar, solo).Os conhecimentos de gestão ambiental permitirão um suporte preliminar ao projeto, estudos de avaliação ambiental e de implementação e operação de sistemas ambientais nas diversas atividades, de cariz industrial, urbano ou comercial.  Saídas Profissionais A L.EA permite a obtenção das competências de base com vista ao exercício pleno da Profissão de Engenheiro do Ambiente.Os Engenheiros do Ambiente desempenham funções em indústrias, empresas de diferentes especialidades ou dedicadas ao ambiente, assim como nos serviços e agências municipais, em áreas tais como: Avaliação ambientalGestão ambientalEcologia industrialGestão de recursos hídricosProjeto e gestão de estações de abastecimento e tratamento de águas/águas residuaisProjeto e gestão de sistemas de tratamento de resíduos sólidosReabilitação de solos e aquíferosGestão de ecossistemasAlterações climáticas e qualidade do arAcústica e vibraçõesPlaneamento e ordenamento do territórioUtilização e implicações ambientais das diferentes fontes de energiaSaúde ambiental e segurança no trabalho. EmpregabilidadeOs novos ciclos de estudo em Engenharia do Ambiente deverão seguir a tendência dos indicadores de empregabilidade do MIEA. A taxa de empregabilidade do MIEA em 2019/2020 foi de 90%. Os dados de empregabilidade baseiam-se no inquérito à Empregabilidade FEUP 2021 e dizem respeito aos graduados do MIEA em 2019/2020 (1.º emprego após término do curso), tendo respondido ao inquérito 74% dos graduados.Colaboração com Empresas e InvestigaçãoA ligação com o tecido empresarial é um dos pontos fortes da formação de Engenharia do Ambiente na FEUP, tradicionalmente com maior enfoque ao nível do Mestrado.Com a restruturação da formação em Engenharia do Ambiente na FEUP, esta colaboração está agora reforçada na licenciatura, nomeadamente mas não exclusivamente através da Unidade Curricular Projeto Integrador.A colaboração com empresas alonga-se também a outros âmbitos que não só a formação dos estudantes, nomeadamente, estudos de consultoria e projetos de Investigação e Desenvolvimento.A listagem seguinte apresenta as empresas que colaboraram e/ ou colaboram com a Engenharia do Ambiente na FEUP de acordo com as áreas sobre as quais se debruça a respetiva colaboração:Águas: Adventech, Águas de Gaia, Águas de Trás-os-Montes e Alto Douro, Águas do Cávado, Águas do Noroeste, Águas do Douro e Paiva, Águas do Minho e Lima, Águas do Porto, Douro ECI, EPAL, Hidrorumo, SMSBVC - Serviços Municipalizados de Saneamento Básico de Viana do Castelo.Energia: Agência de Energia do Porto, Bioportdiesel, Bosch Termotecnologia, EDP Distribuição, EDP-Produção, Efacec, Galp Energia: RENGestão Ambiental: Agência Portuguesa do Ambiente, Ecovisão, Edifícios Saudáveis Consultores S.A., Porto de Leixões, Câmara Municipal do PortoInvestigação e Desenvolvimento: Centro de Estudos de Fenómenos de Transporte, Centro de Física da Universidade de Coimbra (CfisUC), Centro de Investigação do Território, Transportes e Ambiente, CERENA – Centro de Recursos Naturais e Ambiente, CIIMAR - Centro Interdisciplinar de Investigação Marinha e Ambiental, INESC TEC – INESC Tecnologia e Ciência, INSA, Coimbra Biogerm, CEiiA, Instituto de Plasmas e Fusão Nuclear, Laboratório Associado para a Química Verde – Tecnologias e Processos Limpos (REQUIMTE ), Laboratório de Processos de Separação e Reação – Laboratório de Catálise e Materiais, LAETA  - Laboratório Associado de Energia, Transportes e Aeronáutica, LEPABE – Laboratório de Engenharia de Processos, Ambiente, Biotecnologia e Energia.Indústria: A Poveira, BA Glass Portugal, Continental, Cork Supply – Ind, Ikea, Sysadvance, Soja de Portugal, Colep Portugal S.A., FERESPE, Grohe Portugal Componentes Sanitários Lda, upK – Serviços de Gestão de Facilities e Manutenção, S.A., Nestle, Nors, Sicor, Boa Safra, Sogrape.Resíduos: Ambisousa, Empresa Municipal de Ambiente do Porto – Porto Ambiente, Lipor, Resinorte, Sopsa, Suldouro, Valorminho.  Informações    DISCIPLINAS ESPECÍFICASFísica e QuímicaMatemática AouBiologia e GeologiaMatemática A   NUMERUS CLAUSUS34 Nota de Candidatura do Último Colocado pelo Contingente Geral (2021/22 - 42 vagas): 129,5Nota de Candidatura do Último Colocado pelo Contingente Geral (2020/21 - 40 vagas): 144,8Propinas: aqui  Contactos Faculdade de Engenharia da Universidade do PortoRua Dr. Roberto Frias, s/n4200-465 Porto SecretariadoDra. Célia Cerqueira+351 220413614catc@fe.up.pt Dados Gerais Informação para candidatosCódigo Oficial: 9099Diretor: Joana Maia DiasDiretor Adjunto: Maria Cristina VilaSigla: L.EAGrau Académico: LicenciadoTipo de curso/ciclo de estudos: LicenciaturaInício: 2021/2022Duração: 3 Anos Planos de Estudos Plano OficialTodos os Planos Diplomas Licenciatura em Engenharia do Ambiente (180 Créditos ECTS) Áreas Científicas Predominantes Engenharia do AmbienteTodas as classificações Cursos/Ciclos de Estudos Antecessores MIEA - Mestrado Integrado em Engenharia do Ambiente
Licenciatura em Engenharia e Gestão Industrial;    Acreditação pela A3ESO ciclo de estudo encontra-se acreditado pela Agência de Avaliação e Acreditação do Ensino Superior (A3ES). Mais informação pode ser encontrada nos  relatórios produzidos pela A3ES.  Objetivos O objetivo do curso é educar profissionais que combinem o domínio de técnicas de gestão com uma sólida formação em engenharia. O curso envolve uma formação em matemática e física, à qual se alia um conhecimento integrado de questões tecnológicas nas áreas de Conceção e Fabrico, Fluídos e Energia e Automação Industrial. Os estudantes adquirem conhecimentos abrangentes do funcionamento das empresas e da economia. Os graduados devem apoiar a tomada de decisões nas organizações, sendo agentes ativos de mudança e inovação. Os estudantes são incentivados a desenvolver diversas competências sociais, tais como a capacidade de comunicação, a responsabilidade social e o trabalho em grupo. Os objetivos de aprendizagem específicos que os estudantes são incentivados a desenvolver incluem: Adquirir e ser capaz de utilizar com a necessária proficiência conhecimentos de ciências básicas, como a matemática e a Física, e de ciências de engenharia e tecnologias, com especial ênfase nas áreas de conceção e fabrico, fluidos e energia e automação industrial,Adquirir um conhecimento abrangente na área dos métodos quantitativos e sistemas de informação, especialmente vistos como ferramentas de apoio à decisão,Adquirir um conhecimento integrado de gestão empresarial, com ênfase na gestão de operações,Desenvolver atitudes pessoais conducentes a uma atividade profissional de sucesso e a uma intervenção relevante na sociedade, incluindo uma atitude de agente de mudança, criatividade, capa- cidade de comunicação eficaz e de trabalho em grupo,Desenvolver uma atitude de cidadania responsável, com preocupações sociais e ambientais alinhadas com o desenvolvimento sustentável.  Saídas Profissionais O ciclo de estudos pretende alicerçar conhecimentos que possam ter seguimento em formações posteriores em Engenharia e Gestão Industrial, com vista a potenciar carreiras profissionais na indústria ou nos serviços. Os graduados podem exercer funções de gestão em várias áreas funcionais de empresas, incluindo gestão de operações, sistemas de informação e análise financeira. Aqueles que demonstrem apetência para o empreendedorismo, inovação e liderança poderão iniciar seus próprios negócios.  Informações Disciplinas Especificas exigidas para a candidatura em 2021/2022: Física e QuímicaMatemática AClassificações mínimas exigidas no exame nacional destas discpiplinas: 140 pontosNúmeros Clausus: 100 (+7 por reaproveitamento de vagas sobrantes de concursos locais)Página da Licenciatura em Engenharia e Gestão Industrial: https://paginas.fe.up.pt/~estudar/cursos/licenciatura-engenharia-gestao-industrial/  Contactos Secretariado da L.EGI: Soledade Medeiros Tel.: 22 508 2133, 22 041 3439E-mail: legi@fe.up.pt Horário de atendimento presencial: 10h-12h e das 14h-16hSala: L217Horario de atendimento telefonico: 9h às 12.30h e das 14h às 17h Dados Gerais Informação para candidatosCódigo Oficial: 9104Diretor: Vera MiguéisSigla: L.EGIGrau Académico: LicenciadoTipo de curso/ciclo de estudos: LicenciaturaInício: 2021/2022Duração: 3 Anos Planos de Estudos Plano Oficial do ano letivoTodos os Planos Diplomas Licenciatura em Engenharia e Gestão Industrial (180 Créditos ECTS) Áreas Científicas Predominantes Engenharia e Gestão IndustrialTodas as classificações Cursos/Ciclos de Estudos Antecessores MIEGI - Mestrado Integrado em Engenharia e Gestão Industrial
